{"entries":[{"fields":[{"maxLength":64,"name":"lootTable","required":true,"type":"string"}],"key":"chest.wooden","kind":"archetype","stage":"planned","stateNames":["closed","open"],"version":1},{"fields":[{"name":"target","required":true,"target":"body","type":"ref"},{"name":"enabled","required":true,"type":"boolean"}],"key":"core.body.set-enabled","kind":"action","stage":"available","stateNames":[],"version":1},{"fields":[],"key":"core.camera.shake.small","kind":"effect","stage":"planned","stateNames":[],"version":1},{"fields":[],"key":"core.checkpoint.activate","kind":"action","stage":"planned","stateNames":[],"version":1},{"fields":[],"key":"core.chest.open","kind":"action","stage":"planned","stateNames":[],"version":1},{"fields":[{"name":"target","required":true,"target":"encounter","type":"ref"}],"key":"core.encounter.activate","kind":"action","stage":"planned","stateNames":[],"version":1},{"fields":[],"key":"core.encounter.cleared","kind":"event","stage":"planned","stateNames":[],"version":1},{"fields":[{"max":64,"min":0,"name":"density","required":true,"type":"integer"}],"key":"core.env.fireflies","kind":"effect","stage":"planned","stateNames":[],"version":1},{"fields":[{"maxLength":9,"name":"color","required":true,"type":"string"}],"key":"core.env.tint","kind":"effect","stage":"planned","stateNames":[],"version":1},{"fields":[{"name":"flag","required":true,"target":"flag","type":"ref"},{"name":"value","required":true,"type":"boolean"}],"key":"core.flag.set","kind":"action","stage":"available","stateNames":[],"version":1},{"fields":[],"key":"core.guard","kind":"behavior","stage":"planned","stateNames":[],"version":1},{"fields":[],"key":"core.idle","kind":"behavior","stage":"planned","stateNames":[],"version":1},{"fields":[],"key":"core.patrol","kind":"behavior","stage":"planned","stateNames":[],"version":1},{"fields":[],"key":"core.respawn-at-checkpoint","kind":"effect","stage":"planned","stateNames":[],"version":1},{"fields":[],"key":"enemy.bat","kind":"archetype","stage":"planned","stateNames":["hover","patrol","dive","dead"],"version":1},{"fields":[],"key":"enemy.forest-guardian","kind":"archetype","stage":"planned","stateNames":["dormant","fight","dead"],"version":1},{"fields":[],"key":"enemy.slime","kind":"archetype","stage":"planned","stateNames":["idle","patrol","chase","hurt","dead"],"version":1},{"fields":[],"key":"npc.ranger","kind":"archetype","stage":"planned","stateNames":["idle","talk"],"version":1}],"format":"maplab.catalog","id":"catalog.core","version":1}